[{"schemaVersion":"1.0.0","ruleVersion":"1.0.0","geography":{"type":"census_tract","geoid":"34033020100","stateFips":"34","countyFips":"033","tractCode":"020100"},"state":"no_current_gap_flag","label":"No current gap flag","findings":{"elevatedCommunityHealthNeed":false,"elevatedSocialBarriers":false,"documentedShortage":true,"missingRequiredMeasureIds":[]},"ruleInputs":[{"measureId":"cdc_places_diagnosed_diabetes_crude_prevalence","value":10.2,"unit":"percent","operator":">=","threshold":12.3,"triggered":false,"missing":false,"missingReason":null},{"measureId":"cdc_places_coronary_heart_disease_crude_prevalence","value":6.2,"unit":"percent","operator":">=","threshold":6.1,"triggered":true,"missing":false,"missingReason":null},{"measureId":"cdc_places_annual_checkup_crude_prevalence","value":78.6,"unit":"percent","operator":"<=","threshold":76.1,"triggered":false,"missing":false,"missingReason":null},{"measureId":"cdc_places_cholesterol_screening_crude_prevalence","value":89.7,"unit":"percent","operator":"<=","threshold":86.8,"triggered":false,"missing":false,"missingReason":null},{"measureId":"cdc_svi_overall_percentile_rank","value":0.4963,"unit":"percentile_rank_0_to_1","operator":">=","threshold":0.75,"triggered":false,"missing":false,"missingReason":null},{"measureId":"hrsa_active_primary_care_hpsa_component_count","value":0,"unit":"active_designations","operator":">=","threshold":1,"triggered":false,"missing":false,"missingReason":null},{"measureId":"hrsa_active_muap_component_count","value":1,"unit":"active_designations","operator":">=","threshold":1,"triggered":true,"missing":false,"missingReason":null}],"explanations":["1 of 4 community-health thresholds were met; 2 are required.","The overall CDC/ATSDR SVI rank did not meet the published social-barrier threshold.","At least one active reviewed HRSA primary-care HPSA or MUA/P designation intersects the tract.","No current gap flag does not prove adequate access; this rule's elevated-need condition was not met."],"limitations":["This is a screening flag for public-health planning, not a score, ranking, diagnosis, medical advice or statement about an individual.","CDC PLACES values are modeled tract estimates; SVI is an official percentile rank; HRSA designations can cover a whole tract, part of a tract or a defined population group.","No current gap flag does not prove adequate access. It only means this versioned rule did not meet its published elevated-need condition.","A missing required value always produces Insufficient evidence and is never treated as zero or reassuring evidence."],"provenance":{"ruleFile":"public/data/tracts/nj/access-gap-rule.v1.json","sourceEvidenceFamilies":["cdc-places","cdc-svi","hrsa-shortage"],"sourceCheckedDates":["2026-07-12","2026-07-14"],"generatedDate":"2026-07-13"}},{"schemaVersion":"1.0.0","ruleVersion":"1.0.0","geography":{"type":"census_tract","geoid":"34033020200","stateFips":"34","countyFips":"033","tractCode":"020200"},"state":"potential_access_gap","label":"Potential access gap","findings":{"elevatedCommunityHealthNeed":true,"elevatedSocialBarriers":true,"documentedShortage":true,"missingRequiredMeasureIds":[]},"ruleInputs":[{"measureId":"cdc_places_diagnosed_diabetes_crude_prevalence","value":14.5,"unit":"percent","operator":">=","threshold":12.3,"triggered":true,"missing":false,"missingReason":null},{"measureId":"cdc_places_coronary_heart_disease_crude_prevalence","value":6.2,"unit":"percent","operator":">=","threshold":6.1,"triggered":true,"missing":false,"missingReason":null},{"measureId":"cdc_places_annual_checkup_crude_prevalence","value":77,"unit":"percent","operator":"<=","threshold":76.1,"triggered":false,"missing":false,"missingReason":null},{"measureId":"cdc_places_cholesterol_screening_crude_prevalence","value":84.6,"unit":"percent","operator":"<=","threshold":86.8,"triggered":true,"missing":false,"missingReason":null},{"measureId":"cdc_svi_overall_percentile_rank","value":0.7934,"unit":"percentile_rank_0_to_1","operator":">=","threshold":0.75,"triggered":true,"missing":false,"missingReason":null},{"measureId":"hrsa_active_primary_care_hpsa_component_count","value":0,"unit":"active_designations","operator":">=","threshold":1,"triggered":false,"missing":false,"missingReason":null},{"measureId":"hrsa_active_muap_component_count","value":1,"unit":"active_designations","operator":">=","threshold":1,"triggered":true,"missing":false,"missingReason":null}],"explanations":["3 of 4 community-health thresholds were met.","The overall CDC/ATSDR SVI rank met the published social-barrier threshold.","At least one active reviewed HRSA primary-care HPSA or MUA/P designation intersects the tract."],"limitations":["This is a screening flag for public-health planning, not a score, ranking, diagnosis, medical advice or statement about an individual.","CDC PLACES values are modeled tract estimates; SVI is an official percentile rank; HRSA designations can cover a whole tract, part of a tract or a defined population group.","No current gap flag does not prove adequate access. It only means this versioned rule did not meet its published elevated-need condition.","A missing required value always produces Insufficient evidence and is never treated as zero or reassuring evidence."],"provenance":{"ruleFile":"public/data/tracts/nj/access-gap-rule.v1.json","sourceEvidenceFamilies":["cdc-places","cdc-svi","hrsa-shortage"],"sourceCheckedDates":["2026-07-12","2026-07-14"],"generatedDate":"2026-07-13"}},{"schemaVersion":"1.0.0","ruleVersion":"1.0.0","geography":{"type":"census_tract","geoid":"34033020300","stateFips":"34","countyFips":"033","tractCode":"020300"},"state":"potential_access_gap","label":"Potential access gap","findings":{"elevatedCommunityHealthNeed":true,"elevatedSocialBarriers":true,"documentedShortage":true,"missingRequiredMeasureIds":[]},"ruleInputs":[{"measureId":"cdc_places_diagnosed_diabetes_crude_prevalence","value":18.3,"unit":"percent","operator":">=","threshold":12.3,"triggered":true,"missing":false,"missingReason":null},{"measureId":"cdc_places_coronary_heart_disease_crude_prevalence","value":8.2,"unit":"percent","operator":">=","threshold":6.1,"triggered":true,"missing":false,"missingReason":null},{"measureId":"cdc_places_annual_checkup_crude_prevalence","value":77.6,"unit":"percent","operator":"<=","threshold":76.1,"triggered":false,"missing":false,"missingReason":null},{"measureId":"cdc_places_cholesterol_screening_crude_prevalence","value":82.6,"unit":"percent","operator":"<=","threshold":86.8,"triggered":true,"missing":false,"missingReason":null},{"measureId":"cdc_svi_overall_percentile_rank","value":0.8512,"unit":"percentile_rank_0_to_1","operator":">=","threshold":0.75,"triggered":true,"missing":false,"missingReason":null},{"measureId":"hrsa_active_primary_care_hpsa_component_count","value":0,"unit":"active_designations","operator":">=","threshold":1,"triggered":false,"missing":false,"missingReason":null},{"measureId":"hrsa_active_muap_component_count","value":1,"unit":"active_designations","operator":">=","threshold":1,"triggered":true,"missing":false,"missingReason":null}],"explanations":["3 of 4 community-health thresholds were met.","The overall CDC/ATSDR SVI rank met the published social-barrier threshold.","At least one active reviewed HRSA primary-care HPSA or MUA/P designation intersects the tract."],"limitations":["This is a screening flag for public-health planning, not a score, ranking, diagnosis, medical advice or statement about an individual.","CDC PLACES values are modeled tract estimates; SVI is an official percentile rank; HRSA designations can cover a whole tract, part of a tract or a defined population group.","No current gap flag does not prove adequate access. It only means this versioned rule did not meet its published elevated-need condition.","A missing required value always produces Insufficient evidence and is never treated as zero or reassuring evidence."],"provenance":{"ruleFile":"public/data/tracts/nj/access-gap-rule.v1.json","sourceEvidenceFamilies":["cdc-places","cdc-svi","hrsa-shortage"],"sourceCheckedDates":["2026-07-12","2026-07-14"],"generatedDate":"2026-07-13"}},{"schemaVersion":"1.0.0","ruleVersion":"1.0.0","geography":{"type":"census_tract","geoid":"34033020400","stateFips":"34","countyFips":"033","tractCode":"020400"},"state":"potential_access_gap","label":"Potential access gap","findings":{"elevatedCommunityHealthNeed":true,"elevatedSocialBarriers":true,"documentedShortage":true,"missingRequiredMeasureIds":[]},"ruleInputs":[{"measureId":"cdc_places_diagnosed_diabetes_crude_prevalence","value":14.8,"unit":"percent","operator":">=","threshold":12.3,"triggered":true,"missing":false,"missingReason":null},{"measureId":"cdc_places_coronary_heart_disease_crude_prevalence","value":7.6,"unit":"percent","operator":">=","threshold":6.1,"triggered":true,"missing":false,"missingReason":null},{"measureId":"cdc_places_annual_checkup_crude_prevalence","value":78.3,"unit":"percent","operator":"<=","threshold":76.1,"triggered":false,"missing":false,"missingReason":null},{"measureId":"cdc_places_cholesterol_screening_crude_prevalence","value":86.4,"unit":"percent","operator":"<=","threshold":86.8,"triggered":true,"missing":false,"missingReason":null},{"measureId":"cdc_svi_overall_percentile_rank","value":0.8041,"unit":"percentile_rank_0_to_1","operator":">=","threshold":0.75,"triggered":true,"missing":false,"missingReason":null},{"measureId":"hrsa_active_primary_care_hpsa_component_count","value":0,"unit":"active_designations","operator":">=","threshold":1,"triggered":false,"missing":false,"missingReason":null},{"measureId":"hrsa_active_muap_component_count","value":1,"unit":"active_designations","operator":">=","threshold":1,"triggered":true,"missing":false,"missingReason":null}],"explanations":["3 of 4 community-health thresholds were met.","The overall CDC/ATSDR SVI rank met the published social-barrier threshold.","At least one active reviewed HRSA primary-care HPSA or M